,title,text,subject,date
14,"Biden warns Ukraine on reforms, says EU sanctions on Russia at risk","(Reuters) - U.S. Vice President Joe Biden on Wednesday warned Ukraine needs to live up to its promises economic and political reforms or risk seeing the European Union walk away from its sanctions on Russia. “We know that if they give an excuse to the EU, there are at least five countries right now that want to say ‘We want out’” of sanctions against Moscow, Biden said, speaking to the Council on Foreign Relations in New York. Europe imposed sanctions after Russia annexed Ukraine’s Crimea peninsula in 2014. Fighting has continued in the east of the country, despite the so-called Minsk ceasefire agreement, and Western powers fear peace efforts could unravel. In exchange for financial support from the United States and other Western allies, Ukraine promised reforms, but progress has been mixed. Biden’s comments came a day after he met with Ukrainian President Petro Poroshenko at the United Nations, pushing on reforms in Ukraine’s energy and justice sectors, while saying conditions had been met for a third U.S. sovereign loan guarantee of up to $1 billion. Biden said he has spent two to three hours a week on the phone with Ukrainian leaders since the crisis began, urging them to persist with reforms, while also pressuring Germany, France and Italy to hold fast on sanctions. “There’s an overwhelming instinct in Europe to say, ‘Hey: before [Poroshenko] became president, this was owned by Russia anyway. They had a puppet there. What difference does it make? What the hell’s the difference? Why are you making us engage in these sanctions?’” Biden said. Noting a crisis of “self-doubt” in Europe caused by the United Kingdom’s referendum decision to leave the bloc and the Syrian migration crisis, Biden said he has warned Poroshenko to make sure that the failure of the Minsk deal is not blamed on Ukraine. “I’ve been the guy on the back of Ukrainians - which was a thoroughly corrupt system when they came in - making the case that, ‘You have to understand: everybody’s willing to blame the victim, and you better straighten up and fly right,’” Biden said. ",politicsNews,"September 22, 2016 "
15,Philippine leader says 'no way' he'll do deal with Islamist rebels,"MANILA (Reuters) - Philippine President Rodrigo Duterte on Saturday ruled out the possibility of allowing Islamic State-linked militants to flee a southern city in exchange for the release of dozens of hostages. The militants seized large parts of Marawi City on the island of Mindanao in May, and a hardcore of fighters has held out through more than 100 days of air strikes and ground attacks  by troops.  No way,  Duterte told reporters when asked about a rumor that one rebel leader, Omarkhayam Maute, had proposed releasing hostages in exchange for the safe exit of the militants. Pockets of fighters remain in the ruins of the heart of a city devastated by artillery and bombings, in an occupation that has alarmed the region about the possibility of Islamic State, on the back foot in Iraq and Syria, making a new home in the southern Philippines.  The military has launched its final push to retake Marawi, and is coming under heavy fire from gunmen as troops try to secure buildings and navigate through mines and booby-traps. The military estimates about 20 to 30 hostages are being held, some of whom it says were forced to take up arms against government troops.  If I can save one life there, I am willing to wait one year (to retake the city)  Duterte said of the hostages, after visiting wounded soldiers in Cagayan de Oro, a few hours away from Marawi. Martial law has been imposed in Mindanao, an island of 22 million people, until the end of the year, to allow the military to break up an alliance of pro-Islamic State militant groups. On another front, the military is also fighting communist rebels of the New People s Army following a breakdown in peace talks with the government. Duterte on Saturday threatened to expand martial law to other areas of the Philippines to crack down on the insurgents. Some 655 militants, 45 civilians and 145 soldiers and policemen have been killed in Marawi, according to the military, which says it has rescued 1,728 civilians. At least 400,000 have been displaced. Army spokesman Colonal Edgard Arevalo said saving hostages was the priority of the military s mission.  We are still very mindful of the presence of civilians -guns against their heads - who were made human shields or ordered to wield firearms and ammunition, were converted to become fighters and shoot at our troops,  he said in a statement. The United States has provided technical support to the Philippines military in Marawi. Visiting Manila on Friday, Australian Defence Minister Marise Payne offered a small  detachment of soldiers to provide training to Philippine forces. ",worldnews,"September 9, 2017 "
16,Senator Paul suffers five broken ribs after assault: reports,"(Reuters) - U.S. Senator Rand Paul’s return to Washington may be delayed after he suffered five broken ribs during an assault at his Kentucky home, media reported on Sunday, citing a senior adviser to the Republican lawmaker. Paul’s neighbor, Rene Boucher, has been charged with one count of fourth-degree assault causing minor injury in connection with the incident on Friday, according to authorities. Boucher, 59, was released on bond.   “Senator Paul has five rib fractures including three displaced fractures. This type of injury is caused by high velocity severe force,” Doug Stafford, a senior adviser to Paul, said in a statement, according to multiple media reports.  “It is not clear exactly how soon he will return to work, as the pain is considerable as is the difficulty in getting around, including flying,” the reports quoted Stafford as saying. He added that the senator’s type of injury could lead to life-threatening injuries. Paul, 54, also has lung contusions, Stafford said in the statement, according to the reports. The Bowling Green Daily News, citing an arrest warrant, said Paul told police his neighbor came on to his property in a gated community just east of Bowling Green and tackled him from behind. Paul had injuries to the face and trouble breathing because of a rib injury, the newspaper said. It was not clear what motivated the altercation and Paul did not go to the hospital, police said. Paul was mowing his lawn at the time of the attack, television station WAVE-TV in Kentucky reported. “Kelley and I appreciate the overwhelming support after Friday’s unfortunate event. Thank you for your thoughts and prayers,” Paul said on Twitter on Sunday morning, referring to his wife. A man who answered Boucher’s phone on Sunday, when a Reuters reporter asked to speak with him, said: “I’m sorry. I can’t talk.” Kentucky State Police said on Saturday that Paul and Boucher were acquaintances. The suspect is a retired physician, the Bowling Green Daily News said.  The New York Daily News reported that a Facebook page for Boucher contained numerous postings critical of Republican President Donald Trump. Paul, an ophthalmologist, ran for the Republican presidential nomination before dropping out of the race in February 2016. ",politicsNews,"November 5, 2017 "
17,Modi says India shares Myanmar's concern about 'extremist violence',"NAYPYITAW (Reuters) - Prime Minister Narendra Modi said on Wednesday that India shared Myanmar s concern about  extremist violence  in its Rakhine state, where a security force operation against Muslim rebels has sent about 125,000 people fleeing to Bangladesh. Modi spoke after talks with Myanmar s de facto leader Aung San Suu Kyi during a visit aimed at expanding commercial ties as part of an  Act East  policy, and pushing back against Chinese influence.  Myanmar has come under international pressure after some 125,000 Rohingya Muslims fled from a surge of violence in Rakhine state, beginning with an Aug. 25 attack by Rohingya insurgents on dozens of police posts and an army base. The rebel attacks triggered a sweep by the Myanmar security forces, in which refugees and right groups say many innocent Rohingya have been targeted. Buddhist-majority Myanmar rejects accusations by refugees and rights groups that its armed forces have violated the rights of the mostly stateless Rohingya, saying the army and police are fighting  terrorists . Mostly Hindu India has faced years of attacks by Islamist militants.  Suu Kyi told a joint news conference at the presidential palace in the capital, Naypyitaw, that Myanmar was grateful for India s stance on the attack on her country and they could work together to face the challenge.  We would like to thank India particularly for its strong that it has taken with regard to terrorist threat that came to our country a couple of weeks ago,  she said in brief remarks.  We believe that together we can work to make sure that terrorism is not allowed to take root on our soil.  Modi said India and Myanmar had similar security interests in the region.    We share your concerns about extremist violence in Rakhine state and specially the violence against security forces and how innocent lives have been affected,  he said.    We hope that all the stakeholders together can find a way out in which the unity and territorial integrity of Myanmar is respected and at the same time we can have peace, justice dignity and democratic values for all.  Modi s government has taken a strong stance on an influx into India of some 40,000 Rohingya from Myanmar over the years, vowing last month to deport them all. That decision has drawn criticism from rights groups and prompted a petition in the Supreme Court to stop the government from doing so.         International concern, in particular from Muslim countries, is growing about the latest exodus of Rohingya. Turkish President Tayyip Erdogan has pressed world leaders to do more to help the population of roughly 1.1 million, saying they are facing genocide. U.N. Secretary-General Antonio Guterres warned on Tuesday of the risk of ethnic cleansing and regional destabilization. India is trying to boost economic ties with resource-rich Myanmar, with which it shares a 1,600-km (1,000-mile) border, to counter Chinese influence and step up links with a country it considers its gateway to Southeast Asia. Two-way trade has grown to about $2.2 billion as India courts Myanmar following the gradual end of military rule, but Indian-funded projects have moved slowly. India recently started exporting diesel to Myanmar via a land route, in a boost to Modi s pledge to enhance hydrocarbon trade with neighbors.. ",worldnews,"September 6, 2017 "
18,German parties fret about Turkish voters as Erdogan makes mark," BERLIN (Reuters) - Nihan Sen s grandmother came to Germany in the 1960s but still speaks no German. By contrast, Nihan herself is a star of German youth culture, with 783,000 followers for her YouTube channel. Yet she acknowledges:  I really do like a bit of Turkish television.   She is not alone. Turkish broadcasters have an 84 percent market share among Germany s three million people of Turkish background, and 40 percent of them watch no German television at all, according to market researcher Data4U.  As a captive audience of television broadcast from Ankara, Germany s Turkish citizens are caught in a tug-of-war for their loyalty ahead of a German national election on Sept. 24.  Turkey s president, Tayyip Erdogan, has called on German voters of Turkish background to reject Germany s mainstream political parties, saying they are  unfriendly to Turkey .  The parties worry that Erdogan has more access to Turkish-speaking German voters than they do.  Green Party co-leader Cem Ozdemir, the most prominent German politician of Turkish descent, has called for Germany s public media to start broadcasting a Turkish channel for the benefit of Turks, both in Germany and in Turkey.   We need a German-Turkish broadcaster,  he told the Rheinische Post newspaper in March.  For years we ve neglected to help people from Turkey find a new political homeland, also politically, and now we re seeing the fruits of that.   Traditionally, Turks in Germany have voted mainly for the Social Democrats or the Greens, the main center-left parties, which are known for being friendly to immigrants. But Erdogan has repeatedly urged them instead to reject both those parties, as well as Merkel s ruling conservatives.  ""The majority, because they only watch Turkish TV, are informed very one-sidedly,"" said Joachim Schulte, head of Data 4U, which specializes in polling Germany's Turks. Schulte believes Erdogan's call could sway 300,000 votes -- a quarter of the Germans of Turkish descent who are eligible to vote.  For now, voters of Turkish descent who turn away from the Social Democrats and Greens have few other choices. Schulte said those who become disaffected are more likely to stay home than back rival parties. But that could still affect the outcome in an election that is likely to be hard fought for every vote.  A change in Germany s citizenship law in 2000 means the number of ethnic Turks with the right to vote has nearly doubled over the past decade, increasing their importance as a bloc. Polls show most Turks in Germany backed Erdogan when voting as expatriates in Turkish elections.  For Erdogan, having influence over voters in Germany provides a chance to settle scores with German politicians he sees as enemies, while burnishing his credentials at home as a defender of Turks everywhere.  Germany s mainstream parties have been outspoken critics of Turkey s crackdown since a failed coup last year, in which thousands of Turks have been jailed, including around a dozen who hold German citizenship. Turkey also demands that Germany hand over asylum seekers it accuses of involvement in the coup.  For the Social Democrats and Greens, losing the Turkish vote poses a real risk: even a small swing could weaken them in potential talks with the conservatives about setting up a government after the vote.  In recent weeks, a new party, the Alliance of German Democrats, led by ethnic Turks, has campaigned with a poster of Erdogan.  Friends of Turkey,  it reads.  Stand with them!   So far the new party is polling below one percent nationally and fielding candidates only in North Rhine-Westphalia, the big Western state home to more than a fifth of Germany s population.  The national prospects for a minority ethnic party may be limited in a country with a 5 percent threshold to win seats, but a party appealing directly to Turks could undermine the bigger parties.   Our poster was a quote from Erdogan: he was criticizing German politics and saying we should vote for parties that are our friends,  said party spokesman Ertan Toker.  Unlike the other German parties that are always negative about Erdogan, we are not. We saw this as him encouraging us to vote.   Among the causes the new party has taken up: making it easier for ethnic Turks in Germany, most of whom still don t have the right to vote, to gain it. That struck a chord for Rascha, a 17-year-old Turkish girl in Duisburg, North Rhine-Westphalia.   I was born here and I still don t have a German passport,  she said.  The process for getting one is long and bureaucratic. There s a new party that wants to give all permanent residents voting rights.   Turkish community leaders from the big political parties say Erdogan s interventions into German politics are undoing decades of work on promoting integration.   The political climate is poisoned by this,  said Cansel Kiziltepe, Social Democrat parliamentary candidate in Berlin s multi-ethnic Kreuzberg district, where the Social Democrats, Greens and conservatives are all fielding candidates with Turkish roots.  President Erdogan has torn down what we have built up over decades.    We get threats, e-mails as ethnic Turkish lawmakers saying we aren t sufficiently loyal as  Turks ,  Kiziltepe said.  But I am a German politician and I do politics for Germany and for all people who live here.   Timur Husein of Merkel s Christian Democratic Union was categorical about his loyalties:  I am German, only German,  said the son of a Turkish father and a Croatian mother.  For YouTube personality Nihan, who confessed her passion for Turkish TV during an interview with Social Democrat leader Martin Schulz, the worry was that some Turks would end up alienated from wider German society.   What can we do to stop parallel societies from emerging?  she asked Schulz.  Schulz was reassuring. ""It's not bad, or even hard, to have two identities. Why should you deny your roots?""  ",worldnews,"September 13, 2017 "
19,Trump's expected VP pick: coal advocate who defied Obama's climate agenda,"WASHINGTON/NEW YORK (Reuters) - Republican Donald Trump’s selection of Indiana Governor Mike Pence as his running mate cheered the U.S. energy industry and dismayed green advocates, with both sides citing Pence’s support for coal mining and defiance of President Barack Obama’s climate-change agenda. Trump, the presumptive Republican presidential nominee, has called climate change a hoax and promised to gut U.S. environmental regulations in order to help the ailing oil and coal sectors. A Trump-Pence ticket will quash any expectation that the New York businessman might soften that stance heading into the Nov. 8 election. “Governor Pence has been a vocal opponent of the administration’s Clean Power Plan,” said Laura Sheehan, spokeswoman for the Washington-based lobby group American Council on Clean Coal Electricity.   “We would hope to see a continuation,” she said. Trump announced Pence as his running mate in a Twitter post on Friday morning, ending days of speculation over the choice ahead of the party’s national convention in Cleveland next week. [nL1N1A10HR] Pence, 57, is listed on Obama’s “call out the climate change deniers” website for arguing that the science behind climate change has not yet been resolved. In June 2015, Pence wrote to Obama saying that Indiana, America’s eighth largest coal-producing state, would not comply with the Clean Power Plan regulating power plant emissions, calling it “ill-advised.” Indiana is one of more than 25 states that have challenged the centerpiece of the Democratic president’s environmental agenda. In 2014, Pence alarmed local environmental groups by overturning an energy efficiency program enacted by his Republican predecessor, Mitch Daniels, saying it was too expensive for the state’s manufacturers. The Indiana Public Utility Commission had estimated the program would create more than 18,600 jobs. “The choice of Pence shows Trump has little interest in appealing to anyone outside of his extremist base and Big Polluters,” said Clay Schroers, a director at the League of Conservation Voters environmental group.     Trump has long signaled his support of traditional energy production - part of his broader appeal to blue-collar American voters.  He outlined plans in May to sweep away environmental regulations ushered in by Obama, scrap the Paris Climate Accord, and revive the Keystone XL pipeline proposal – moves that would reverse years of gains by the green movement. Trump’s Democratic rival, Hillary Clinton, in contrast, has promised more stringent regulation of the energy sector, efforts to boost renewable fuels use, and a commitment to join other nations to combat global climate change. Pence ran for governor in 2012 after serving in the U.S. Congress. His campaign for governor received more than $850,000 from the energy sector, about 3 percent of the total, according to campaign finance disclosures. More than $300,000 of that came from the billionaire Koch brothers, strong advocates of small government and fiscal conservatism who took a liking to Pence. Both David and Charles Koch have said they will not support the Trump ticket. Trump has alarmed many Republican establishment figures with his fiery rhetoric on immigration and trade.  But a former high-ranking operative in the Koch political organization who is close to both brothers said Pence could help make the donor network more receptive to Trump’s campaign. ",politicsNews,"July 14, 2016 "
