,title,text,subject,date
7,BRUCE SPRINGSTEEN Reveals The Shocking Truth About His Rock Anthem “Born In The USA”,"The truth about Springsteen is so disappointing (see below) but this one takes the cake!Bruce Springsteen has been a sellout all these years. He s not the person he portrayed himself to be to the American people.He just revealed he nearly gave up  one of his most iconic anthems Born In The USA, admitting he believed it was too insincere and  glib . He said he doesn t  feel comfortable  singing the song. It s almost like he s apologizing for appearing to be patriotic. Are you thinking what we re thinking? He sang that song so many times but never felt ok singing it? That s the difference between Springsteen and someone like Lee Greenwood. Lee Greenwood has always been a passionate and fearless supporter of America and the American way. Springsteen is just a phony Speaking at a Q&A session with Tom Hanks at the Tribeca Film Festival, the 67-year-old rocker opened up to the Oscar-winning actor, insisting that it was E Street Band guitarist Stevie Van Zandt who convinced him to keep the 1984 hit.Springsteen s memorable tune was written in part tribute to friends who had served in the American Army during the Vietnam War and the ironic treatment of the veterans upon their return home. He divulged:  Stevie [Van Zandt, longtime guitarist in the E Street Band] convinced me to keep that song. I remember at the time thinking it s too glib. It s too glib. I think I still think that. But Stevie said,  No, no, no   it s about the band, the brotherhood of the band, the fans. The New Jersey native   who has been married to Patti Scialfa since 1991   added that he gave his musical peer the  benefit of the doubt  but still doesn t feel quite comfortable with the song.Adding:  I gave him the benefit of the doubt. We ve played it an awful lot ever since. But I was always a little frightened of it. And the whole record I always have mixed feelings about.  Despite his feelings, the epochal song has received much praise throughout the years and was ranked 275th on Rolling Stone s list of The 500 Greatest Songs of All Time as well as placed on RIAA s Songs of the Century.The fan favorite and title track of his 1984 album of the same name inspired famed photographer Annie Leibovitz s iconic photo of Springsteen s backside against the backdrop of an American flag for the record cover. Commenting on the concept in 1984, the Medal of Freedom recipient told Rolling Stone:  We had the flag on the cover because the first song was called  Born in the U.S.A. , and the theme of the record kind of follows from the themes I ve been writing about for at least the last six or seven years.Read more: Daily MailSPRINGSTEEN JUST RELEASED A SONG THAT BASHES PRESIDENT TRUMP Bruce Springsteen aka  The Boss  is showing all of his fans just how out of touch he is with his latest song. He s been a fervent anti-Trump guy and has been very outspoken against President Donald Trump. His new protest song refers to Trump as a  con man . What a way to disrespect the leader of our nation! has Bruce Springsteen employed thousands of Americans? It s interesting that Trump just delivered one of the best ever speeches to the builders union. Please watch the video provided below of what a real working man does for his crew. It s an awesome speech that totally discounts everything Springsteen is trying to say to bash Trump. Shame on him!The 67-year-old rocker released his and Joe Grushecky s anti-Trump song, called  That s What Makes Us Great,  and it is a direct comment on the president and his administration, according to Pitchfork.Springsteen s part of the song goes as follows: Don t tell me a lieAnd sell it as a factI ve been down that road beforeAnd I ain t going back.And don t you brag to meThat you never read a bookI never put my faithIn a con man and his crooks.  During an interview with the Pittsburgh Post-Gazette, Gushecky talked about writing the song in January after Trump was sworn-in as president I had this song, and Bruce and I had been talking,  Grushecky said.  I sent it to him and he liked it. I said,  What do you think about singing on it?  He gave it the Bruce treatment. In February, Springsteen said he was an  embarrassed  American during a concert in Australia. On the same tour he attacked Trump s first travel ban as  un-American. Tonight we want to add our voice to the thousands of Americans who are protesting at airports around our country the Muslim ban and the detention of foreign nationals and refugees,  Springsteen told the crowd.  America is a nation of immigrants. This is fundamentally un-American. What a bunch of bull! Springsteen has lost his roots and his sense of the working man. If he cared to know anything about President Trump then he would know Trump s bringing back American jobs. He s working hard to get the steel industry up and running again. He just held a  Buy American, Hire American  event promoting keeping jobs in America. What s better than a president who s a builder speaking to builders and construction workers. In President Trump s speech he calls out people by name pretty great! He knows business and building. We re in good hands America! The era of economic surrender has come to an end. It s come to an end. We have surrendered as a country to outside interests. The era of economic victory for our country has just begun. You will see.. Oh, you will see    President Trump",politics,"Apr 30, 2017"
8, Trump Experiments With State-Run TV And Gets Laughed Off The Internet,"Well, it s happened. In the manner of every other authoritarian douchebag since the invention of mass communications, Donald Trump is now experimenting with state-run television.Now, he is having his daughter-in-law Lara Trump host a  real news  program (as opposed to all the  FAKE NEWS  organizations who insist on telling the truth about him) directly on his Facebook page. Want to know what President Trump did this week?  the post says.  Watch here for REAL news! Naturally, what followed was a grievous misrepresentation of what actually happened through the week   and most of it, if not all, had already been covered by the  FAKE NEWS  media and in press conferences (which are also apparently FAKE NEWS now).(function(d, s, id) {  var js, fjs = d.getElementsByTagName(s)[0];  if (d.getElementById(id)) return;  js = d.createElement(s); js.id = id;  js.src = ""//connect.facebook.net/en_US/sdk.js#xfbml=1&version=v2.10"";  fjs.parentNode.insertBefore(js, fjs);}(document, 'script', 'facebook-jssdk'));Want to know what President Trump did this week? Watch here for REAL news!Posted by Donald J. Trump on Sunday, July 30, 2017Naturally, Americans are completely unimpressed by this. Though a spattering of mindless dolts showed up to support Trump s new propaganda outlet, most comments on the video look like this:               At this point, we must wonder what it will take for Republicans to finally drum this tinpot wannabe dictator out of office.In the words of the great Frederick Douglass, who s done an amazing job and is getting recognized more and more,  Fuck this shit. Featured image via screengrab",News,"August 2, 2017"
9,GAY MARRIAGE APPROVED BY SUPREME COURT With Ironic Dissenting Opinion From Justice Roberts: “But this court is not a legislature”,"The  Fundamental Transformation  of America is almost complete. Even Barack Hussein Obama must be surprised by how few hurdles have been placed in his way In less than 24 hours, our leftist US Supreme Court delivered not one, but two sucker punches to the heart of America. The acts of these radical judicial activists will have a dramatic effect on our society and culture in the United States of America.    The Supreme Court declared Friday that same-sex couples have a right to marry anywhere in the United States.Gay and lesbian couples already could marry in 36 states and the District of Columbia. The court s 5-4 ruling means the remaining 14 states, in the South and Midwest, will have to stop enforcing their bans on same-sex marriage.The outcome is the culmination of two decades of Supreme Court litigation over marriage, and gay rights generally. Justice Anthony Kennedy wrote the majority opinion, just as he did in the court s previous three major gay rights cases dating back to 1996. It came on the anniversary of two of those earlier decisions. No union is more profound than marriage,  Kennedy wrote, joined by the court s four more liberal justices.The four dissenting justices each filed a separate opinion explaining their views. But this court is not a legislature. Whether same-sex marriage is a good idea should be of no concern to us,  Chief Justice John Roberts wrote in dissent. Roberts read a summary of his dissent from the bench, the first time he has done so in nearly 10 years as chief justice.Justice Antonin Scalia said he is not concerned so much about same-sex marriage, but about  this court s threat to American democracy.  Justices Samuel Alito and Clarence Thomas also dissented.The ruling will not take effect immediately because the court gives the losing side roughly three weeks to ask for reconsideration. But some state officials and county clerks might decide there is little risk in issuing marriage licenses to same-sex couples.The cases before the court involved laws from Kentucky, Michigan, Ohio and Tennessee that define marriage as the union of a man and a woman. Those states have not allowed same-sex couples to marry within their borders and they also have refused to recognize valid marriages from elsewhere.Just two years ago, the Supreme Court struck down part of the federal anti-gay marriage law that denied a range of government benefits to legally married same-sex couples.The decision in United States v. Windsor did not address the validity of state marriage bans, but courts across the country, with few exceptions, said its logic compelled them to invalidate state laws that prohibited gay and lesbian couples from marrying.The number of states allowing same-sex marriage has grown rapidly. As recently as October, just over one-third of the states permitted same-sex marriage.There are an estimated 390,000 married same-sex couples in the United States, according to UCLA s Williams Institute, which tracks the demographics of gay and lesbian Americans. Another 70,000 couples living in states that do not currently permit them to wed would get married in the next three years, the institute says. Roughly 1 million same-sex couples, married and unmarried, live together in the United States, the institute says.Via: AP News ",Government News,"Jun 26, 2015"
10,"Holding keys to debt limit, Democrats weigh tax demands","WASHINGTON (Reuters) - Democrats in the U.S. Congress wield little clout nowadays, but they will likely have plenty of influence on the looming issue of the U.S. debt ceiling and party leaders are considering whether they should try to convert that advantage into bargaining power on tax reform. Even though they control the White House and both chambers of Congress, Republicans are again divided among themselves as pressing fiscal issues rattle financial markets and test President Donald Trump’s ability to keep the country’s accounts in order. The debt ceiling is a legal cap on how much money the federal government can borrow to fund its budget deficits and meet debt obligations. Failure to meet payments could lead to a default and a downgrade in America’s credit rating, with the potential to trigger global financial shockwaves. Speaking to reporters at the White House on Friday, U.S. Treasury Secretary Steven Mnuchin said he was “100 percent confident” that the debt ceiling would be raised in September. “There is no scenario where the government won’t be paying its bills,” Mnuchin said. Action is needed to raise the debt ceiling by Sept. 29, the administration has warned, although some fiscal experts say the deadline may actually be mid-October. The Trump administration wants Congress to pass a “clean” increase, without extraneous political measures attached. But, reflecting long divisions in the party over fiscal policy, many conservative Republicans have said they will not  vote for a debt-limit bill that does not also contain promises of federal spending cuts. So, analysts say, Trump and Republican leaders will need the votes of Democrats, who generally favor a clean bill, to raise the debt limit and avoid a default. Armed with this edge, Democrats are considering using the debt debate to press Republicans for bipartisan tax reform, said Democratic Senate aides, which would inject new uncertainty into the debt limit issue. Overhauling the tax code is a top priority for Trump and his fellow Republicans, but they have made little progress since the president took office in January. Their behind-closed-doors planning process so far on tax reform has ignored the Democrats. Senate Democratic leader Chuck Schumer and House of Representatives Democratic leader Nancy Pelosi are skeptical about supporting a debt ceiling increase while Republicans pursue tax cuts that Democrats say would cause the federal deficit to balloon. “We’re telling Republicans that if it is their intention to use that debt limit increase to allow for tax cuts for the wealthy, that they are going to have a harder time getting Democratic votes,” said a Senate Democratic aide. Senate Democrats offered earlier this month to move forward with bipartisan legislation on taxes, on condition that changes do not add to the deficit or benefit the wealthy. For now, Senate and House Democrats are watching  Republicans and the Trump administration wrangle over the debt ceiling, with no clear plan yet in sight. Senate Majority Leader Mitch McConnell and House Speaker Paul Ryan have not said if they want a clean bill. Ryan said on Thursday that Congress will pass legislation to raise the federal debt ceiling, noting that lawmakers have several options. McConnell has said the debt ceiling will be raised, a spokesman said on Thursday. Pelosi spokesman Drew Hammill said in an email: “Leader Pelosi has expressed support for a clean debt ceiling hike, but has also echoed the concerns that many House Democrats have about supporting such a move while Republicans simultaneously blow a multi-trillion dollar hole in the deficit with tax cuts for millionaires and billionaires.” Given the stakes, Schumer and Pelosi would face a daunting task in holding their parties’ lawmakers together if they want to squeeze concessions out of Republicans with the country on the brink of a potential default. Some Democrats are skeptical such a strategy could work. “We ought to get the debt ceiling done. It’s a bad precedent to try to use the debt ceiling for leverage for other political objectives,” said Representative John Yarmuth, the top Democrat on the House Budget Committee. Federal Reserve Governor Jerome Powell expressed concern on Friday about the possibility of the debt ceiling not being raised.  “If the debt ceiling were not to be raised, the United States would not be able to pay all of its bills. That’s never happened before; it would be unprecedented and that could be a major shock to the economy,” Powell said in an interview with CNBC during a conference in Jackson Hole, Wyoming. Democrats have been talking about using the debt ceiling as a lever against Republican tax reform since June and laid out their conditions for working together on tax legislation in an Aug. 1 letter to Trump and Republican leaders. McConnell flatly rejected the idea of broad bipartisanship. But it could be the only way forward on taxes if Republicans cannot agree on a budget resolution for fiscal 2018. That is needed to unlock a legislative provision that would allow them to pass a tax bill in the Senate, where Republicans have only a slim majority, without Democratic support.     ",politicsNews,"August 25, 2017 "
11,"Timeline: From TVs to microwaves, White House tries to explain wiretapping charge","WASHINGTON (Reuters) - The White House on Friday distanced itself from a news report it  embraced a day earlier that Britain’s top-secret eavesdropping agency monitored Trump Tower at former U.S. President Barack Obama’s behest. The White House had cited the report by a Fox News analyst as it sought to defend President Donald Trump’s charge that Obama’s administration wiretapped him during the 2016 election. Over the past two weeks, Trump and his aides have pressed the claim in numerous ways, including suggestions that Trump may have been monitored through microwaves and television sets. The White House has provided no proof to support Trump’s allegation and the heads of U.S. House and Senate intelligence panels, including from Trump’s Republican Party, have rejected it.  Here is a chronology of the administration’s assertions: MARCH 4: In a series of early morning tweets, Trump accuses Obama of having his wires tapped and calls him a “bad (or sick) guy.” Trump spokesman Sean Spicer says the White House’s top lawyer was examining options for pursuing the claim. MARCH 5: The White House cites reports of potentially politically motivated investigations, and says Trump wanted the congressional intelligence committees to examine whether executive branch investigative powers were abused in 2016. MARCH 6: Spicer suggests monitoring may have been broader than a wire tap, might have been conducted under a secret foreign intelligence eavesdropping warrant and that “there is substantial reporting out there from individuals and from sources” that such surveillance occurred. MARCH 7: Spicer says while there is no new proof of Trump’s allegation, the president has absolutely no regrets about his tweets and that he was “not walking anything back or regretting.” MARCH 12: Senior White House adviser Kellyanne Conway suggests in an interview with the Bergen County Record newspaper that the monitoring may have been conducted through television sets or “microwaves that turn into cameras.” MARCH 13: Conway says her comments the previous day were misconstrued but continues to air the allegation about the president and wiretapping at Trump Tower. Spicer says Trump’s charges were based on reporting by a number of news organizations, including Fox, the BBC and the New York Times. Trump’s use of the word “wiretapping ... spans a whole host of surveillance types of options,” Spicer says. MARCH 14: Spicer says Trump is extremely confident the Justice Department would find evidence proving his allegation. MARCH 15: Republican and Democratic leaders of the House Intelligence Committee say they have seen no evidence of wiretapping. The White House defends Trump’s allegation, and Trump says in a Fox News interview that, “We will be submitting things before the committee very soon that hasn’t been submitted as of yet. But it’s potentially a very serious situation.” MARCH 16: The Republican and Democratic leaders of the Senate Intelligence Committee, and House Speaker Paul Ryan, separately say there is no proof of Trump’s charge. Spicer says there is no question that surveillance techniques were used. He cites a litany of news reports to justify the allegation. They include an assertion by a Fox News analyst, former New Jersey Judge Andrew Napolitano, that he had been told by unidentified intelligence officials that Obama obtained transcripts of Trump’s conversations from Government Communications Headquarters, or GCHQ, the British agency that monitors overseas communications. MARCH 17: The administration backs away from the Fox News report after the British government said it was assured by the White House that it would not repeat Napolitano’s allegation, dubbed “nonsense” by a GCHQ spokesman. “Mr. Spicer was simply pointing to public reports, not endorsing any specific story,” said a White House official.      ",politicsNews,"March 17, 2017 "
12,European leaders and Obama to discuss Russia sanctions in Berlin: sources,"BERLIN (Reuters) - European leaders and President Barack Obama on Friday will discuss extending sanctions imposed on Russia for its intervention in Ukraine, and possible new sanctions for its bombing in Syria, sources familiar with the plans said. The meeting in Berlin, hosted by German Chancellor Angela Merkel and including the leaders of Britain, France, Italy and Spain, comes a little over a week after Donald Trump’s victory in the U.S. presidential election. Trump has indicated that he will seek a rapprochement with Russia, raising doubts in Europe about the future of the sanctions regime introduced by Washington and Brussels in 2014 following Russia’s intervention in eastern Ukraine. A German official said the plan was to agree a rollover of EU sanctions against Russia, which are due to expire at the end of January, in the coming weeks. There is concern that Trump might move in the opposite direction after his inauguration on Jan. 20. European leaders will therefore be seeking clarity from Obama, who met Trump last week and said afterwards the president-elect would maintain core relationships around the world, including with NATO. Obama arrived in Berlin on Wednesday evening after visiting Greece.  “We’re in a really critical situation,” said the German official. “We have to prevent a situation where the EU rolls over the sanctions and then the new U.S. president comes in and lifts them.” Obama and Merkel are expected to hold talks on Thursday followed by a news conference at which they will raise the issue of Syria, a source said. European officials fear that Russia will use the time before Trump’s inauguration to launch new offensives in Syria and Ukraine. Two diplomatic sources said the issue of Syria would also come up at the Friday meeting. “Syria will definitely be on the agenda,” said one, citing coordinated Russian missile strikes against rebels in Syria launched on Tuesday from an aircraft carrier in the Mediterranean. The Kremlin has said it is maintaining a moratorium on air strikes in the city of Aleppo. European Union leaders last month condemned Russia for its bombing of civilians in Aleppo and signaled that they could introduce new sanctions for its actions there if the bombing continued. The Syrian opposition has been pressing Western countries to expand sanctions to include some Russian firms that are supplying weapons and bank notes to Syria. Syrian opposition leaders are due to meet with EU leaders, including EU foreign policy chief Federica Mogherini, in Brussels on Friday. Another source said European leaders were keen to send a signal to Trump, making it more difficult for him to reverse U.S. policy and cosy up to Russia. ",politicsNews,"November 16, 2016 "
13,"Trump asks team to trim back transition efforts, focus on race: sources","NEW YORK (Reuters) - Trailing in opinion polls, Republican presidential nominee Donald Trump has asked his campaign to cut back on work identifying candidates for key jobs in his would-be administration and focus instead on bolstering his chances on Election Day, according to two people familiar with the campaign’s inner workings. After months of bitter battling, Trump’s Democratic rival, Hillary Clinton, has a commanding lead in the race to win the Electoral College and claim the U.S. presidency on Nov. 8, according to the latest Reuters/Ipsos States of the Nation project results released on Saturday, which mirror other national polls.  People working on Trump’s White House transition, which is led by New Jersey Governor Chris Christie, have been asked by Trump to narrow down those efforts and refocus on the race, the sources, who asked not to be identified, said Tuesday. They have, as a result, largely set aside efforts to identify candidates for key Cabinet positions, but are continuing work to fill lower-level jobs, such as Securities and Exchange Commission general counsel, that would allow Trump to begin basic work on his agenda if he won on Nov. 8, without worrying about winning political battles first. Members of the transition team are also avoiding providing Trump with updates on the transition work to allow him and the campaign to focus the core of its efforts on improving his chances of winning the election, the sources said. Trump spokeswoman Hope Hicks did not immediately respond to a request for comment. The sources did not say when Trump asked his campaign to reduce its transition work. But one of the two sources said that Christie has spent twice as much time helping Trump prepare for the three presidential debates, which occurred between Sept. 26 and Oct. 19, as he had on the transition work. A spokesman for Christie declined to comment. A third source familiar with the campaign, who also asked not to be named, said a senior Trump official has been contacting Wall Street tycoons and other wealthy Republicans for recommendations on lower-level positions.  That source said the Trump team has opened up its hiring search far beyond his core group of supporters and is even willing to consider people who have criticized the brash New York businessman. ",politicsNews,"October 25, 2016 "
